Категория,Подкатегория,Бренд,Название товара,Артикул,"Цена, ₽",Описание,Сезон,Пол,Размер,Цвет,Материал,"Старая цена, ₽",Остаток,Фото (ссылка или файл),Новинка / Хит / Акция,Активен (да/нет)
Аксессуары,,1017 Alyx 9SM,Dani Cardholder (White),AXUWA0001LE01,8000,"Кардхолдер (визитница) ALYХ Dani Selfridges Exclusive (White). Выполнен из кожи с тиснением логотипа бренда, имеет три внешних отделения под карты и одно на молнии.",Демисезон,Унисекс,O/S,Белый,Натуральная кожа,,1,,,Да
Обувь,,Maison Margiela,Tabi Rubber 80mm (Red),S38WU0378 P4365 H9048,43000,Ботильоны таби Maison Margiela Tabi Ankle Boots. Материал верха - матовый полиуретан ; подошва из резины.,Осень/Зима,Женское,37,Красный,Полиуретан,,1,,,Да
Одежда,,1017 Alyx 9SM,Cropped Hoodie (Purple),AAWSW0122FA02,14000,Укороченное худи 1017 ALYX 9SM Collection Logo Cropped Hoodie,Демисезон,Женское,XXS,Фиолетовый,Хлопок,,1,,,Да
Одежда,,Bottega Veneta,Gilet Intreccio Nylon (Yellow),700402-VF4K0-7214,104000,"Стеганый пуховой жилет Bottega Veneta Gilet Intreccio Tech Nylon. Верх из плотного нейлона, наполнитель - гусиный пух с добавлением пера.",Осень/Зима,Мужское,М,Лайм,Нейлон,,1,,,Да
Обувь,,1017 Alyx 9SM,Mono Sneakers (Black),AAUSN0029LE01 BLK,17000,"Верх из кожи с вставками из сетки, внутри подкладка из натуральной кожи. Массивная подошва из материала EVA Vibram",Демисезон,Женское,39,Черный,Натуральная кожа,,1,,,Да
Одежда,,1017 Alyx 9SM,Knit Disco Top (Purple),AAWKN0115YA01-PLE0001,16000,,Весна/Лето,Женское,M,Фиолетовый,Полиэстер,,1,,,Да
Одежда,,Maison Margiela,Belted Bermuda (Navy),S51MU0061-S24254-511,23000,,Весна/Лето,Женское,36,Темно-синий,Шерсть,,1,,,Да
Обувь,,Maison Margiela,Strappy Tabi Sandals (White),S39WP0082 PR869 T1003,34000,Мюли Maison Margiela Strappy Tabi Sandals с узнаваемым фирменным носом Таби и аккуратным каблуком. Мюли Maison Margiela Strappy Tabi Sandals с узнаваемым фирменным носом Таби и аккуратным каблуком.,Весна/Лето,Женское,"36,5",Белый,Натуральная кожа,,1,,,Да
Аксессуары,,Maison Margiela,Cardholder Blue Medium,!,16000,,Демисезон,Унисекс,O/S,Синий,Натуральная кожа,,1,,,Да
Аксессуары,,Maison Margiela,Cardholder Blue Large,!,18000,,Демисезон,Унисекс,O/S,Синий,Хлопок,,1,,,Да
Обувь,,Maison Margiela,Tabi 30mm Boots (Green),S58WU0273 P3753 T7143,69000,"Ботильоны таби Maison Margiela Tabi Ankle Boots из кожи мятно-изумрудного цвета на аккуратном каблуке. Верх выполнен из мягчайшей воловьей кожи тонкой выделки, внутри также подкладка из кожи. Наборный каблук высотой 30мм, застежки на косточках.",Осень/Зима,Женское,36,Темно-зеленый,Натуральная кожа,,1,,,Да
Обувь,,Rick Owens,Birkenstock Arizona (Black),BW18S8898 LE09,24000,"Классические сандалии Arizona Extro в прочтении Rick Owens, цвет 'Amalfi Black'. Удлиненные ремешки из гладкой черной кожи. Ортопедическая стелька из пробкового материала, отделанная кожей Nappa.",Весна/Лето,Женское,36,Черный,Натуральная кожа,,1,,,Да
Обувь,,Maison Margiela,Tabi Rubber Derby (Green),S58WQ0125 P4365 T7166,31000,"Материал верха - матовый полиуретан ; подошва из резины. Вощеные круглые шнурки, фирменный нос таби. Нетривиальный и практичный вариант на осенний сезон.",Осень/Зима,Женское,37,Темно-зеленый,Полиуретан,,1,,,Да
Обувь,,Maison Margiela,Tabi Rubber Derby (Brown),S58WQ0125  P4365 Т8031,33000,"Материал верха - матовый полиуретан ; подошва из резины. Вощеные круглые шнурки, фирменный нос таби. Нетривиальный и практичный вариант на осенний сезон.",Осень/Зима,Женское,38,Коричневый,Полиуретан,,1,,,Да
Одежда,,1017 Alyx 9SM,Icon Flower T-Shirt (White),AAUTS0384FA01-WTH0001,14000,"Хлопковая футболка белого цвета с принтом от 1017 ALYX 9SM. Свободный крой, принт ""St. Marks Place"" на груди.",Весна/Лето,Мужское,M ; L,Белый,Хлопок,,1,,,Да
Обувь,,Rick Owens,Converse Turbowpn (Black),DC01DX848 A03R1,27000,"Верх из натуральной кожи, узнаваемый удлиненный язычок, массивная подошва.",Демисезон,Мужское,42,Черный,Хлопок,,1,,,Да
Обувь,,Maison Margiela,Tabi Hi Sneakers (Yellow),S57WS0253 P1875 T3027,29000,Кеды таби Maison Margiela Tabi High Top Sneakers. Кеды таби Maison Margiela Tabi High Top Sneakers,Демисезон,Мужское,41,Желтый,Хлопок,,1,,,Да
Одежда,,1017 Alyx 9SM,Arch Logo Sweatshirt (Black),AAUSW0184FA01-BLK0001,15000,,Демисезон,Мужское,S,Черный,Хлопок,,1,,,Да
Одежда,,1017 Alyx 9SM,Arch Logo T-Shirt (Black),AAUTS0393FA01-BLK0001,12000,,Демисезон,Мужское,S,Черный,Хлопок,,1,,,Да
Одежда,,1017 Alyx 9SM,Lightercap Hoodie (Red),-,14000,,Демисезон,Женское,S,Красный,Хлопок,,1,,,Да
Обувь,,Maison Margiela,Tabi Low Sneakers (Blue),s37ws0578-p5345-h9683,27000,,Весна/Лето,Мужское,41,Синий,Хлопок,,1,,,Да
Одежда,,1017 Alyx 9SM,Icon Flower T-Shirt (Black),AAUTS0384FA01-BLK0001,14000,,Весна/Лето,Мужское,M,Черный,Хлопок,,1,,,Да
Одежда,,1017 Alyx 9SM,Lightercap Tank Top (Yellow),-,12000,,Весна/Лето,Женское,M,Лайм,Хлопок,,1,,,Да
Одежда,,1017 Alyx 9SM,Lightercap Tank Top (White),-,12000,,Весна/Лето,Женское,M,Белый,Хлопок,,1,,,Да
Обувь,,Maison Margiela,Tabi 80mm Boots (Jute),S38WU0383 P5015 H0195,63000,"Ботильоны таби Maison Margiela Jute Tabi Ankle Boots с нетривиальным материалом верха. Материал внешней отделки - джутовое полотно, внутри идет подкладка мягчяйшей воловьей кожи. Наборный цилиндрический каблук высотой 80мм, застежки на косточках и форменный нос Tabi.",Осень/Зима,Женское,35,Натуральный,Натуральная кожа,,1,,,Да
Обувь,,Maison Margiela,Decolette Slingback (Cream),S58WL0211 P3753 T1003,39000,"Туфли Maison Margiela Decolette Slingback Pumps. Зауженная форма мыса вкупе с низким фигурным каблуком и четкими линиями ремешка с небольшой эластичной вставкой создают элегантный силуэт. Выполнены из матовой кожи кремового оттенка, имеют фирменную строчку на внешней части и тиснение MM22 на стельке.",Весна/Лето,Женское,35,Кремовый,Натуральная кожа,,1,,,Да
Обувь,,Balenciaga,Wmns Trooper Boots (Black),679326 W0FO8 1000,52000,"Массивный силуэт, тракторная подошва, нос квадратной формы. Выполнены из термопластичного полиуретана.",Осень/Зима,Женское,39,Черный,Резина,,1,,,Да
Одежда,,1017 Alyx 9SM,Unreal Hoodie (Black),AAUSW0104FA01,17000,"Толстовка с капюшоном от 1017 ALYX 9SM. Свободный крой, принт ""F21-ALYX-AAU UNREAL” на спине, карман спереди.",Демисезон,Мужское,S,Черный,Хлопок,,1,,,Да
Одежда,,1017 Alyx 9SM,2X Logo Hoodie (Tan),AAUSW0180FA01-TAN,16000,,Демисезон,Мужское,L,Коричневый,Хлопок,,1,,,Да
Обувь,,Gucci,Adidas Gazelle Indoor GG,737967 FAAW3 1084,45000,"Верх выполнен в фирменном узоре монограммы GG из материала Demetra. Переработанная в коллаборации с Gucci модель Adidas Gazelle Indoor в расцветке ""Black GG Monogram"". Полупрозрачная подошва цвета Gum имеет брендирование GG на средней части, а также на протекторе.",Демисезон,Женское,40,Черный,Нейлон,,1,,,Да
Аксессуары,,Alice Hollywood,Alice FC Cap (Red),-,16000,,Демисезон,Унисекс,O/S,Красный,Хлопок,,1,,,Да
Аксессуары,,Alice Hollywood,Hollywood Hardcore Cap (White),-,16000,,Демисезон,Унисекс,O/S,Белый,Хлопок,,1,,,Да
Одежда,,Raga Malak,Raga United Top (Blue/White),-,16000,,Весна/Лето,Унисекс,XS,Синий,Полиэстер,,1,,,Да
Одежда,,Raga Malak,I Drive Zip Top,-,17000,,Весна/Лето,Унисекс,XS,Розовый,Полиэстер,,1,,,Да
Одежда,,Raga Malak,Stan Top,-,14000,,Весна/Лето,Унисекс,XS,Синий,Полиэстер,,1,,,Да
Одежда,,Raga Malak,Dropout Tee,-,13000,"Футболка с принтом Dropout T-Shirt (Black) от молодого австралийского бренда RAGA MALAK. Выполнена из плотного хлопка, слегка укороченый оверсайз силуэт.",Весна/Лето,Унисекс,XS ; S,Черный,Хлопок,,1,,,Да
Аксессуары,,Raga Malak,Innocent Trucker Cap,-,15000,"Кепка 'Innocent' Trucker Cap (White) от молодого австралийского бренда RAGA MALAK. Передняя часть и козырек из хлопкового канваса, сзади сетка и застенка снэпбэк. Вышитый логотип ‘Innocent’ спереди, дистресс на козырьке и передней панели.",Демисезон,Унисекс,O/S,Белый,Хлопок,,1,,,Да
Одежда,,Raga Malak,Bullet Top,-,14000,,Весна/Лето,Мужское,XXL,Белый,Хлопок,,1,,,Да
Одежда,,Raga Malak,Rokyo Bikini Top,-,6000,,Весна/Лето,Женское,S,Черный,Полиэстер,,1,,,Да
Одежда,,Raga Malak,Rokyo Bikini Bottom,-,7000,,Весна/Лето,Женское,M,Черный,Полиэстер,,1,,,Да
Одежда,,Raga Malak,Peace Bikini Top,-,6000,,Весна/Лето,Женское,S,Черный,Полиэстер,,1,,,Да
Одежда,,Raga Malak,Peace Bikini Bottom,-,7000,,Весна/Лето,Женское,S XS,Черный,Полиэстер,,1,,,Да
Одежда,,Raga Malak,Pray Tank (Black),-,17000,,Весна/Лето,Мужское,XL,Черный,Хлопок,,1,,,Да
Одежда,,Raga Malak,Pray Tank (White),-,17000,,Весна/Лето,Мужское,XL,Белый,Хлопок,,1,,,Да
Одежда,,No/Faith Studios,Saarland Zipper (Used Grey),-,26000,"Толстовка с капюшоном на молнии Saarland Zipper (Used Grey) от No/Faith Studios. Свободный крой, вывернутые швы, принт 'ZIKKURAT NFS' на груди. Карманы на передней части, подкладка из вафельной ткани в капюшоне.",Демисезон,Мужское,2 ; 3,Серый,Хлопок,,1,,,Да
Обувь,,Maison Margiela,Evolution Low (White),S97WS0055 P4366 T1003,40000,"Модель словно сложили из текстильной и кожаной пар, разобранных на детали. Шнурки разных оттенков при этом нарочито небрежно связали узлами. Верх из канваса и гладкой кожи, вулканизированная подошва из резины.",Демисезон,Женское,39,Белый,Натуральная кожа,,1,,,Да
Одежда,,Vetements,Stop Being Rich Fitted T-Shirt,WE63TR160W WHIT,17000,,Весна/Лето,Женское,M,Белый,Хлопок,,1,,,Да
Одежда,,Vetements,5G White Oversized T-Shirt,UA53TR380W WHIT,21000,,Весна/Лето,Мужское,XS,Белый,Хлопок,,1,,,Да
Обувь,,Rick Owens,Converse Turbowpn (Clay),DC01BX342 64,21000,,Демисезон,Женское,"40,5",Коричневый,Натуральная кожа,,1,,,Да
Обувь,,Rick Owens,Converse Turbodrk Hi (Zebra),A03943C,14000,"Верх из искусственной овчины с паттерном Zebra, узнаваемый удлиненный язычок. Модифицированная подошва с литым носом квадратной формы и массивной задней частью.",Демисезон,Женское,37,Зебра,Искуственная овчина,,1,,,Да
Обувь,,Rick Owens,Converse Turbodrk Hi (Dust),DC01CX938 A03R0 34,15000,"Верх из плотного хлопкового канваса, узнаваемый удлиненный язычок. Модифицированная подошва с литым носом квадратной формы и массивной задней частью.",Демисезон,Женское,"37,5",Серый,Хлопок,,1,,,Да
Обувь,,Rick Owens,Converse Turbodrk (Denim),A01291C,22000,"Верх из лакированного денима, узнаваемый удлиненный язычок. Модифицированная подошва контрастного цвета с литым носом квадратной формы и массивной задней частью.",Демисезон,Женское,37,Черный,Хлопок,,1,,,Да
Обувь,,Rick Owens,Converse DBL Drkstar Ox (White),DC02CX955 A04R1 21,21000,,Демисезон,Мужское,"42 ; 42,5",Кремовый,Хлопок,,1,,,Да
Обувь,,Maison Margiela,Tabi 60mm Vintage Suede Boots,S58WU0246 P4350 T2154,102000,,Осень/Зима,Женское,38,Коричневый,Натуральная кожа,,1,,,Да
Обувь,,Maison Margiela,Tabi 60mm Leather Boot (Brown),S58WU0246 P3753 T2264,102000,,Осень/Зима,Женское,39,Бордовый,Натуральная кожа,,1,,,Да
Аксессуары,,Maison Margiela,Tabi Camera Bag (White),SB3WG0039 P5025 T1003,29000,,Демисезон,Женское,O/S,Белый,Натуральная кожа,,1,,,Да
Одежда,,Vetements,Big Barcode Sweatshirt (White),-,25000,,Демисезон,Мужское,S,Белый,Хлопок,,1,,,Да
Обувь,,Balenciaga,Strike Leather Boots (Black),589338WA9601000,87000,,Осень/Зима,Женское,38,Черный,Натуральная кожа,,1,,,Да
Обувь,,Rick Owens,Converse Turbodrk Hi (Pink),DC01CX685-A05R0-13,17000,"Верх из плотного хлопкового канваса, узнаваемый удлиненный язычок. Модифицированная подошва с литым носом квадратной формы и массивной задней частью.",Демисезон,Женское,38,Розовый,Хлопок,,1,,,Да